MalwareJake,Sun Sep 15 16:54:11 +0000 2019,Unpacking Snowden's Actions,"politics, history & business",https://twitter.com/MalwareJake/status/1173278854007394307,"With @Snowden book coming out, I'm hearing multiple respected people in the industry say ""the domestic programs were wrong, I just don't agree with how he released the data."" I get where these people are coming from, but let's examine why this is a hollow argument. 1/","6. Lots of other people in the IC saw this illegal collection activity and looked the other way. I always find it curious nobody ever wants to talk about that. Because every one of those people took an oath to defend the constitution against all enemies, foreign AND domestic /FIN","With @Snowden book coming out, I'm hearing multiple respected people in the industry say ""the domestic programs were wrong, I just don't agree with how he released the data."" I get where these people are coming from, but let's examine why this is a hollow argument. 1/ ~tweetbreak~ It's worth noting that I don't endorse Snowden's actions, but I DO have a better understanding than most what his options really were. So let's talk about that a little.

First, it's easy to say ""but whistleblower protections!"" That is the WORST POSSIBLE argument to use here. 2/ ~tweetbreak~ Intelligence community contractors didn't have whistleblower protections in 2013 when Snowden leaked. But the US government recognized what a problem this was and fixed it, right? Um, no. No they didn't. There may be a Snowden 2.0 festering in the IC right now as a result. 3/ ~tweetbreak~ What about ""he shouldn't have gone to Hong Kong""? Okay, but this assumes that anyone who wants to leak illegal activity by the IC should be ready to go to prison themselves. I'm not sure I'm there. I want people to be able to out illegal activity without threat of prison. 4/ ~tweetbreak~ The there's the question of ""why did he go to Russian then""? But that just demonstrates you don't know history (or refuse to Google). Russia was not the first country to offer Snowden asylum. Each country that offered before Russia withdrew the asylum offer. 5/ ~tweetbreak~ I can only assume there was a systematic operation by the State Department to pressure these other countries to withdraw their asylum offers. Russia just honey badgered it. Honestly, I think we created the Russia issue and it seems odd to focus on it now. 6/ ~tweetbreak~ Another popular argument is ""but Snowden must be giving Putin information now."" I'm not sure I believe this. His very presence in Russia is a middle finger to the US. The US housed not-insignificant numbers of Soviet political refugees during the cold war for the same reason. 7/ ~tweetbreak~ Finally, I'll address ""but why did he take more information than the domestic surveillance program info""? I think the simple answer is that Snowden didn't know what he didn't know. Ironically, the same who make the ""too much data"" argument like to hint at his lack of access. 8/ ~tweetbreak~ But we DO know that Snowden uncovered programs that effectively turned the Constitution into a Choose Your Own Adventure book. He watched DNI Clapper and Gen. Alexander (DIRNSA) lie about these programs, under oath, to oversight committees. This is indisputable. 9/ ~tweetbreak~ I do then think it's reasonable to ask ""what else don't I know?"" If you can get there, then I totally understand why he would take whatever he could get his hands on. If the goal is to leak data about illegal classified programs, why limit the scope? 10/ ~tweetbreak~ Anyway, I'll close with this:
1. There is no question the IC was breaking the law. The public only knows about it because of Snowden.
2. I'm no supporter of Snowden, but I also recognize this isn't a black and white issue. It's shades of grey. 11/ ~tweetbreak~ 3. Feel free to hold any opinion on his actions you want, but FFS educate yourself before sharing. For instance, before saying ""treason"" know the ACTUAL definition of the word and then be ready to explain how his actions amount to that. Any less is irresponsible hyperbole... 12/ ~tweetbreak~ 4. I won't be engaging sealions looking to argue in bad faith. I am not ""human Google."" Use Google to seek out facts before responding/asking for clarification of my positions. 13/ ~tweetbreak~ 5. I spent a lot of time away from my family engineering legitimate intelligence collection missions. Many of those suffered substantially from information revealed by the press as a result of the Snowden leaks. There is no love here. ""Hate"" is too strong, but so is ""like"" 14/ ~tweetbreak~ 6. Lots of other people in the IC saw this illegal collection activity and looked the other way. I always find it curious nobody ever wants to talk about that. Because every one of those people took an oath to defend the constitution against all enemies, foreign AND domestic /FIN",1,0,1,0,0,1,0,1,0,0,0,0,1,1,1,1,1,0
andibartz,Tue Nov 05 18:37:01 +0000 2019,Why Preorder Books,"politics, history & business;culture & the humanities",https://twitter.com/andibartz/status/1191786513476079616,"You have probably heard me stating that preordering a book from an independent bookseller is the most impactful thing you can do if you're going to buy an author's book. Lately some of you wonderful people have asked for more detail, so I thought I'd explain! [THREAD]","BUT I REALLY JUST WANT TO USE AMZN...That's okay, too! Every single preorder matters and lets a publisher know there's early interest. I just wanted to share more info. Buying books is an amazing act, no matter where or how you do it! Thx, friends. 💕 /9","You have probably heard me stating that preordering a book from an independent bookseller is the most impactful thing you can do if you're going to buy an author's book. Lately some of you wonderful people have asked for more detail, so I thought I'd explain! [THREAD] ~tweetbreak~ WHAT COUNTS AS AN INDIE BOOKSTORE? Click-to-buy (ahem), B&amp;N, and other huge chains aren't independent bookstores. No hate, but I'm talking about locally owned, community booksellers. /2 ~tweetbreak~ When you preorder from one of those, an actual human sees the sale and thinks, ""There's local interest in this book! I should look into it."" Maybe they'll be inspired to devote some table space to it when it comes out, or even to read it themselves and make it a staff pick. /3 ~tweetbreak~ Your preorder from an indie bookstore also makes a book more likely to hit the NYT bestseller list (#dreamingbig), since the Times system heavily weights purchases at small, privately owned book shops. /4 ~tweetbreak~ HOW CAN I FIND ONE? Go to https://t.co/uvEDABSOwj and enter your zip code on the right, where it says ""locate an independent, local bookstore."" (cc @indiebound) /5 ~tweetbreak~ BUT WILL THEY STOCK IT? That's where your preorder makes a huge difference: It puts it on the bookseller's radar and makes them more likely to stock it! But even if they decide not to put it on shelves, they will order it just for you and let you know when it's in. /6 ~tweetbreak~ BUT NOTHING'S NEAR ME! That's okay. You can still preorder from an indie bookstore and they'll ship it to you for a few bucks more; if you preorder from @booksaremagicbk  in Brooklyn, I'll sign it for you at my launch party! /7 ~tweetbreak~ You can also preorder a book directly from https://t.co/uvEDABSOwj, and they'll split the profit between their member bookstores. /8 ~tweetbreak~ BUT I REALLY JUST WANT TO USE AMZN...That's okay, too! Every single preorder matters and lets a publisher know there's early interest. I just wanted to share more info. Buying books is an amazing act, no matter where or how you do it! Thx, friends. 💕 /9",0,0,1,0,1,0,0,1,0,0,0,1,1,1,1,1,1,0
maggiekb1,Fri Nov 08 14:24:06 +0000 2019,Why College Rankings are Crap,"politics, history & business;culture & the humanities",https://twitter.com/maggiekb1/status/1192810026773016581,I've been thinking about this for a day and a half now. And here's why. This game exists because a metric (selectivity) exists. And metric exists because ... once upon a time a newsmagazine decided they could make some good side money ranking colleges. https://t.co/jlGQUfPFf3,I once literally heard the principal at my kids' current school tell a prospective parent that part of why our school didn't score as high as another school across town was because we didn't hire a person whose sole job was to massage the Great Schools ranking.,"I've been thinking about this for a day and a half now. And here's why. This game exists because a metric (selectivity) exists. And metric exists because ... once upon a time a newsmagazine decided they could make some good side money ranking colleges. https://t.co/jlGQUfPFf3 ~tweetbreak~ Does ""selectivity"" actually tell you anything useful about how good your education will be? 

What does ""selectivity"" actually measure that is of value to a student? 

Why do I have the feeling somebody chose this metric cause they just needed more stuff to rank by? ~tweetbreak~ A few years ago, I read a research paper that used the US News and World Report college rankings as an example of how we take subjective arbitrary metrics and adopt them as representative of objective worth and then reshape whole systems around them. ~tweetbreak~ And it boils down to this: 
You could make a useful-to-students guide to colleges. But that takes a lot of reporting. Because many of the things students want to know are subjective and can't be well captured in numbers. And you have to do it, yourself, over and over. ~tweetbreak~ Or, you could come up with a bunch of metrics that colleges submit to you and that look scientific and objective. And that's a lot easier. Requires fewer reporters. Makes the universities compete for your favor in ways you can maybe monetize. So why not? ~tweetbreak~ That, my friends, was an editorial decision. 

An editorial decision that has had broad-ranging effects on how kids feel about themselves, how schools treat them, what schools feel pressured to spend $ on (and raise tuition for) ... ~tweetbreak~ And I guess the big takeaway for me is to spend more time thinking about the downstream effects of editorial decisions. When I make a choice, what could the consequences of that choice be? ~tweetbreak~ Well, that, and my usual rant about ""just because it's data doesn't mean it's objective fact that tells you what you need to know"". ~tweetbreak~ Relatedly, parents, keep this shit in mind when you're thinking about Great Schools rankings in your area. Ask questions about the metrics your public school is judged by. And then think about whether they are really telling you what you want to know. ~tweetbreak~ At one point, I was looking at a house in a neighborhood whose grade school at a ""2"" ranking with Great Schools. And I got all worried. And I looked into it. It had low test scores because more than 50% of its students were ESL. But the teachers were winning awards. ~tweetbreak~ The principal was beloved. It had some really cool after school robotics and language and arts stuff. 

It was not a bad school. It was a school that scored poorly on a ranking system. ~tweetbreak~ I once literally heard the principal at my kids' current school tell a prospective parent that part of why our school didn't score as high as another school across town was because we didn't hire a person whose sole job was to massage the Great Schools ranking.",0,0,1,0,1,0,0,0,0,1,1,0,1,1,1,1,1,0
ewanbirney,Sun Dec 01 13:02:55 +0000 2019,"Genetics, Intelligence, and Ethnicity",biology & climate,https://twitter.com/ewanbirney/status/1201124518284210176,Yesterday I did another bit of twitter back and forth with someone with a strong belief that there strong biological differences between ethnic groups - a particular focus being intelligence - and I just want to lay out why I spend time on this on twitter,"That the genetics of intelligence is genomewide, not obviously recently selected and that ethnicity labels are crude, broad groupings across complex human history means genetics has a low - if any - contribution to between ethnic group educational differences.","Yesterday I did another bit of twitter back and forth with someone with a strong belief that there strong biological differences between ethnic groups - a particular focus being intelligence - and I just want to lay out why I spend time on this on twitter ~tweetbreak~ (As followers will know, I've been on this for a while, with @aylwyn_scally, @AdamRutherford and @JenniferRaff as a group who we bounce ideas off and discuss) ~tweetbreak~ The first thing is to realise that I don't believe I will ""win over"" many - perhaps any - of the people who talk on twitter about this. The reason why I engage is to open up the arguments which I think are often more broadly held but not discussed. ~tweetbreak~ I think the following (wrong) position is commonplace: 
Ethnicity is mainly genetic. Physical + mental traits have varying levels of genetics; lots (height) to some (intelligence). Therefore part of the reason why ethnic groups have different education outcomes is genetic. ~tweetbreak~ People often will add that this ""part reason"" is small vs societal differences, but explains the lack of progression to the highest levels of some ethnic groups, and couple this whole statement with a strong ""equality under the law"" and individuals have to be treated the same. ~tweetbreak~ So - what is wrong with this position? Oddly enough the main things which are wrong is not what people expect - that genetic variation is a substantial component to the variation in intelligence measures / educational attainment. The genetics of intelligence measures are robust. ~tweetbreak~ Rather there are two things which wrong. The first is rather fundamental - many things can be genetic but not correlated to each other - your hair colour and intelligence measures for example, or your height and your chance of getting colon cancer ~tweetbreak~ So - saying two things have a genetic component in no way says that by tracking one thing (whatever the genetics is that goes into ethnic group determination) helps predict another thing (in this case measures of intelligence) ~tweetbreak~ This is because the genome is a very big place, and sex  shuffles randomly across it. It's complex to explain in detail;  think of it as if there are ~300,000 independent parts of the genome. Each parent passes on a pretty perfect shuffle between half of each of their parents. ~tweetbreak~ The second thing is that despite many people being pretty confident of their own ethnic group assignment (though not all!) and often confident about making snap assessments of other people (eg ""Afro-Caribbean"") ethnic groups labels are in fact a long way off genetics. ~tweetbreak~ There is a lot to unpick here. Ethnicity is often defined by a mixture of physical characteristics (skin colour is a big part, but there is more than that) and cultural aspects, in particular language, dress and mannerisms. ~tweetbreak~ Skin colour is not so much of the genome; in the 300,000 odd places in the genome it is at most 3,000 odd places (and that's being generous). Facial features, height etc might take you to up to 30,000 or so - most of the genome is not in the genetics of physical ethnicity traits ~tweetbreak~ This is most obviously recognisable in ""mixed race""  families, where it is often the case that children will have a big variation in skin colour and other attributes. ~tweetbreak~ But the ""formation"" of ethnic groups is also due to complex mixing of people's - both in terms of genetics and culture. Some have been recent, but some old and many we haven't traced out yet. ~tweetbreak~ For example, ""Europeans""  is a mix of three quite distinct groups : stone age hunter-gatherers, Anatolian farmers + Steppe pastoralists. Part of the population of Anatolian farmers migrated as well down the east coast of Africa, contributing genetics and likely farming culture ~tweetbreak~ Another massive migration was from Spain to central and south America, with the harsh Conquistador group having a large genetic and cultural stamp in combination with different native american people - this broad grouping leads to the Hispanic ethnic group ~tweetbreak~ Another obvious case is trans-atlantic slavery giving rise to a mixture of different genetic and cultural components from mainly from west africa plus European genetics and culture and then, in particular in the Caribbean, south Asian due to indentured servants ~tweetbreak~ The *norm* for humans is to partly migrate and mix at the scale of genetic timescales - human population geneticists expect to see more and more detail as we sequence more living humans and in particular more ancient bones ~tweetbreak~ The ""ethnicity"" concepts are laid on top of this complex genetic mixing a culturally driven way - the labels are not good proxies for genetics and can never really be because genetics is far messier and far more independent areas ~tweetbreak~ Because of this, although the physical aspects of ethnicity have a genetic component, ethnicity is just not a good proxy to genetics. For starters it is just one label for this complex thing but also is just a big mess underneath ~tweetbreak~ Some skeptics - and people who hold hard onto the sense of racial differences - might agree with all of this but then say ""but there are still *some* level of genetic differences between ethnic groups"" and this ""must contribute even if it is just a little bit"" ~tweetbreak~ So - there are genetic differences between people, yes, and formally any grouping of people measured at good enough precision on anything will show differences, but this is true for *any* arbitrary grouping. ~tweetbreak~ I might as well characterise people across the world by the Premier League football club they support, and then measure height, educational attainment, colon cancer genetics..., and there will be differences. But that difference would be arbitrary by classification. ~tweetbreak~ Critically it would not be very useful for me to ask everyone on applications to tick ""which Premier League football club do you support"" with a ""prefer not to say"" box, and then use that inform decisions. Far better to ... assess people directly. ~tweetbreak~ Are ethnic group labels as arbitrary as Premier League football clubs? It's probably a close run thing (for a variety of reasons, Premier League club support is weirdly  hetreogenous worldwide). Both though are not *useful* proxies. ~tweetbreak~ Furthermore, due to the endless mixing of humans (it is really a constant thing), the arbitrary groupings over 50 years ago will just morph into arbitrary groupings now and in the future. Hence ""Cape Coloured"" and ""Black British in Liverpool"". ~tweetbreak~ That the genetics of intelligence is genomewide, not obviously recently selected and that ethnicity labels are crude, broad groupings across complex human history means genetics has a low - if any - contribution to between ethnic group educational differences.",1,0,1,0,1,0,0,1,0,1,1,0,1,1,0,1,1,0
kareem_carr,Thu Jul 09 00:41:03 +0000 2020,Data Analysis Alone is Not Enough,physics & maths,https://twitter.com/kareem_carr/status/1281025540883963907,"AS A STATISTICIAN, I respect science expertise because I need it to do my job right. In the early days of the pandemic, I saw debate develop between those advocating we listen to experts and those who felt we should listen to the data. This is a false dichotomy, let me say why...",Thanks for coming to my TED talk.,"AS A STATISTICIAN, I respect science expertise because I need it to do my job right. In the early days of the pandemic, I saw debate develop between those advocating we listen to experts and those who felt we should listen to the data. This is a false dichotomy, let me say why... ~tweetbreak~ This false dichotomy was concerning to me because analyzing data without scientific expertise is dangerous. Analysis needs to be grounded in real world experience (derived from experiments) of what is plausible. Without this, we can be worse off for having looked at the data. ~tweetbreak~ A lot of people think asking questions of data is a foolproof way of learning more about the world. That as long as your statistics methodology is good and you have high-quality data, you will be smarter after you try to answer a question with data than before. This is not true. ~tweetbreak~ You have to be careful about asking questions of data because badly framed questions can smuggle assumptions into your thought processes that actively make you more wrong than if you never tried to answer those questions at all. ~tweetbreak~ ""What kind of cheese is the moon made of?"" is a bad question that will actively make you stupid. No amount of investigating what cheese most closely matches the properties of the moon will help you here. Good cheese data won't help you. State of the art algorithms won't help you. ~tweetbreak~ The only thing that will help is to reject the question and go back to where you were before you asked it. You need to ask what material is the moon made of? Could it be cheese or something else? This seems obvious but people make this mistake in data analysis all the time. ~tweetbreak~ ""Are covid-19 infection rates affected by racial genetics?"" is potentially one of these kinds of bad questions. In the context of looking at broad patterns between racial populations, it assumes too much. The point here is subtle so let me illustrate. ~tweetbreak~ Is being likely to have spent time in my childhood home genetic? Presumably, my nuclear family has genes specific to us and we all lived there. My relatives have genes that are more like me and they are more likely to have spent time in the house than the general population. ~tweetbreak~ I can promise you that if you get a dataset of people and try to figure out if being closely related to me makes you more likely to have spent time in my family home, you will see a beautiful pattern like my 1st cousins are more likely to be there than 2nd cousins and so on. ~tweetbreak~ This is the genetics version of the cheese question. We assumed that living in the house was genetic and then we are narrowing down the genetic variants that cause it. This model predicts the past data, but it doesn't predict future data because it's not a causal pattern. ~tweetbreak~ If you put those genes in a new person, they won't instinctively wander off in search of my childhood home. This kind of thing is why we need to be careful about looking at patterns in human data and thinking that these patterns automatically mean something is genetic. ~tweetbreak~ We need more evidence outside of just patterns. We need experiments to help us figure out plausible types of causation and we need to be careful about assuming everything that differs between races is genetic. Not only does it needlessly promote racism, it's often bad science. ~tweetbreak~ Thanks for coming to my TED talk.",1,1,0,1,1,1,0,0,0,0,1,1,1,1,0,1,0,0
