XiranJayZhao,Thu Aug 06 00:18:04 +0000 2020,MSG isn't Bad for You,"politics, history & business;health & the body",https://twitter.com/XiranJayZhao/status/1291166617154486272,"THREAD: why the notion that MSG is bad for you is a racist hoax and needlessly deprived us of so much deliciousness

so MSG was first isolated in 1908 by Japanese chemist Kikunae Ikeda, who also coined the term ""umami"" for the flavor 1/? https://t.co/Q5KZOKobye","ANYWAY, if you insist on going out to eat even now, support your local Chinese restaurants, who have been losing business due to COVID-related racism

here's my thread on why you shouldn't scoff at ""inauthentic"" Chinese food, also a common misconception:
https://t.co/ZcetEA01uB","THREAD: why the notion that MSG is bad for you is a racist hoax and needlessly deprived us of so much deliciousness

so MSG was first isolated in 1908 by Japanese chemist Kikunae Ikeda, who also coined the term ""umami"" for the flavor 1/? https://t.co/Q5KZOKobye ~tweetbreak~ Ikeda was inspired to seek out the flavor when he noticed his wife's dashi stock was EXTRA DELICIOUS when she would add kombu seaweed to it. he eventually identified the chemical source as glutamate, and believed humans found it so delicious because it was associated with protein ~tweetbreak~ now...MSG is not some weird, suspicious artificial flavoring! it's found in a lot of natural foods, and isolated from them too. Ikeda got it from wheat and soybeans specifically. the only danger that comes from MSG is eating too much of it...because of its sodium component 3/? 😒 ~tweetbreak~ the whole panic around MSG started when a doctor wrote to the New England Journal of Medicine in 1968 like OH MAN MY HEAD HURTS AND MY LIMBS TINGLE EVERY TIME I GO TO A CHINESE RESTAURANT, I THINK IT MAY BE ALL THE MSG THEY PUT IN THE FOOD??? 4/? ~tweetbreak~ mind you, this was just a letter to the editor, not a scientific study. there are conflicting sources about who this doctor really was so i'm not gonna get into it, just know that he labeled his symptoms ""Chinese Restaurant Syndrome."" 5/? ~tweetbreak~ after the letter was published, other doctors piled on with their testimonies of OMG THAT'S TOTALLY TRUE CHINESE FOOD ABSOLUTELY WRECKS ME

BUT what the public didn't know was that many of these responses were ironic jokes and exaggerations 6/? https://t.co/IVEIigunVl ~tweetbreak~ but since this conspiracy theory of ""CHINESE RESTAURANTS ARE MAKING YOU SICK WITH THEIR MSG"" totally fit into the ""Chinese food is dirty and dangerous"" narrative, news outlets began reporting on these ironic accounts in full seriousness, and often with racist tones 7/? https://t.co/IvLgAyzoUp ~tweetbreak~ the hoax spiraled so wildly out of control that scientists started treating Chinese Restaurant Syndrome like a real thing and did studies to prove MSG caused it, such as this one from 1969

except these studies were highly flawed in that participants KNEW they were eating MSG 8/? https://t.co/CSHuHxmTpY ~tweetbreak~ later on, when scientists actually did blinded tests, not telling the participants whether they were eating food that had MSG or not, they couldn't find any links to adverse symptoms, even in people who claimed they had an MSG sensitivity 9/? ~tweetbreak~ so, MSG has been scientifically proven safe for literal decades, yet the hoax has persisted in the public mind because it fits racist fantasies and works to degrade Chinese food (especially Chinese American food) as dirty, cheap, and unhealthy 10/? ~tweetbreak~ I still see Chinese restaurants and food products try to distance themselves from this with ""NO MSG"" labels, and it makes me sad because GOD I hope they didn't take out all that deliciousness for no good reason😩 11/? ~tweetbreak~ also, fast food joints like Chick-fil-A are known to use a ton of MSG in their food, yet they were spared from the panic. coincidence? I THINK NOT.

(though do boycott them because they're homophobic, thanks) ~tweetbreak~ ANYWAY, if you insist on going out to eat even now, support your local Chinese restaurants, who have been losing business due to COVID-related racism

here's my thread on why you shouldn't scoff at ""inauthentic"" Chinese food, also a common misconception:
https://t.co/ZcetEA01uB",1,0,0,0,1,0,0,1,1,1,0,0,0,1,1,1,1,1
DocMCohen,Thu Jul 30 21:08:00 +0000 2020,Gender Segregation in Medical Specialties,"health & the body;politics, history & business",https://twitter.com/DocMCohen/status/1288944457107124226,"What happens when certain types of medical work become synonymous with women’s work? 

This excellent paper by @ElainePelley &amp; @Molly_Carnes explores the trend of ⬆️gender segregation in medical specialties and downstream impacts.

#WomenInMedicine THREAD
https://t.co/1fBJ9Nyh3W","There’s tons more to discuss, but this thread is way too long. We need more discussion on how women entering a field devalues it. We also need to broaden this analysis to include ALL of health care, which is full of women doing vitally important &amp; shamefully underpaid work. 
FIN","What happens when certain types of medical work become synonymous with women’s work? 

This excellent paper by @ElainePelley &amp; @Molly_Carnes explores the trend of ⬆️gender segregation in medical specialties and downstream impacts.

#WomenInMedicine THREAD
https://t.co/1fBJ9Nyh3W ~tweetbreak~ Women have moved into medicine in huge numbers over the past 4 decades. This is usually viewed as a good news story of social progress in a profession that had either banned or severely restricted female entry well into the 1960’s. ~tweetbreak~ The authors begin with a discussion on gender segregation in the broader workforce (in the US). It generally decreased thought the 20th C with the entry of women into the workplace, but then stalled in the mid-90’s and ticked back upwards slightly. ~tweetbreak~ When a large number of women enter a previously male dominated occupation, it will quickly move towards female predominance. This phenomenon is known as “tipping” and it has NOT been shown to happen in reverse (ie, men don’t tend to take over fields seen as “women’s work”). ~tweetbreak~ When an occupation hits the gender tipping point (which varies roughly from 13-45% female), entry of men rapidly declines. This is the pattern demonstrated by teachers, secretaries, bank tellers, etc. ~tweetbreak~ In academia and professions requiring high educational attainment, a tipping phenomenon occurs at 24% female. In other words, once a field is ¼ female, men start to lose interest in it. It loses prestige and the ineffable qualities granted by gender exclusivity. ~tweetbreak~ What’s the evidence that a field loses prestige with female entry? At around the 38% female mark, interest from BOTH men AND women starts to decline. Research also shows an inverse relationship between how challenging a field seems and how many female PhDs are in it. ~tweetbreak~ And this is where we need to talk about the #GenderPayGap. Because not only do female dominated occupations earn less than male dominated occupations, historical data shows that each 10% increase in female share results in a 0.5-5% decline in earnings. ~tweetbreak~ The #GenderPayGap is at it’s simplest about paying women less for equal work. But the gendering of occupations plays a MAJOR (and often overlooked) role. Research on high skill occupations shows men essentially take a pay cut when they enter female dominated professions. ~tweetbreak~ This bring us to medicine. A profession with DRAMATIC gender segregation among its specialties and little-to-no introspection on the impact of this phenomenon. In Canada, female representation among medical specialties varies from roughly 10% to 75%. ~tweetbreak~ Historically, once women were allowed into medical school, they were immediately shunted into the specialties that seemed appropriate. Ones that involved babies or so-called “soft skills” like counseling. They were strongly discouraged from entering macho fields like surgery. ~tweetbreak~ I say “historically” but of course, these ideas remain as strong as ever (that’s what happens when your industry lacks introspection on its own subculture). 

Ask any woman in medicine and she will tell you LOTS of stories like this one.👇 https://t.co/lUCjemV6Yv ~tweetbreak~ Naturally, we lack data on the gender segregation of specialties over time. If you can’t SEE a phenomenon, you can’t study it, right? Fortunately, this paper digs into historical data, showing that US gender segregation in medical specialties has remained static since the 80’s. ~tweetbreak~ The 80’s. That’s my entire lifetime. American medicine has remained frozen in the same sexist ideas about women and men’s “natural” skills since the Reagan years. 

Is Canadian medicine any better? We haven’t analyzed historical data (yet), but I think you know what I would say. https://t.co/3pSCdMVBuQ ~tweetbreak~ Getting back to the #GenderPayGap, this paper does what few have – it looks at how feminization of a specialty impacts its relative earnings over time. This is such an important analysis and I can’t believe we don’t have more like these. ~tweetbreak~ For example, pediatrics went from 22% to 63% female since 1975, but orthopedics has remained nearly the same. Subsequently, pediatrics went from earning 93% of the average MD salary to 71%. Meanwhile orthopedics went from 160% to 180% of average. ~tweetbreak~ Want a more apples to apples comparison? Let’s look at OB &amp; urology: OB has lost relative income since the 70’s while going from 8% to 57% female. Meanwhile, urology has maintained its relative earnings (125% of average MD salary) while remaining at &gt;90% male. ~tweetbreak~ While I haven’t looked at historical data in Canadian medicine, I have done a lot of work analyzing the gender breakdown in specialties and their relative incomes. Those results will be published next month, but let me summarize it quickly now: ~tweetbreak~ Gender segregation in Canadian medical specialties is a MAJOR factor in the #GenderPayGap. There are many other relevant factors at play, but the shunting of women into “female-friendly” specialties while discouraging entry into male dominated specialties plays a huge role. ~tweetbreak~ There’s tons more to discuss, but this thread is way too long. We need more discussion on how women entering a field devalues it. We also need to broaden this analysis to include ALL of health care, which is full of women doing vitally important &amp; shamefully underpaid work. 
FIN",0,0,1,0,0,0,0,0,0,1,1,1,1,1,0,1,1,1
itsjacksonbbz,Thu Jan 16 22:50:20 +0000 2020,Pronoun Usage,culture & the humanities,https://twitter.com/itsjacksonbbz/status/1217942189512237056,"I really hate how transness is always flattened and reduced so that the cis can understand it.

The most current iteration of it is cis people being told that ""they/them"" are THE ""nonbinary pronouns"".

It don't work like that lol","And that's the Gender 101 class for the cis today lol.

There are no de facto male pronouns. No de facto female pronouns. No de facto nonbinary pronouns. Just pronouns that people like you to use for them. It's that simple.","I really hate how transness is always flattened and reduced so that the cis can understand it.

The most current iteration of it is cis people being told that ""they/them"" are THE ""nonbinary pronouns"".

It don't work like that lol ~tweetbreak~ First of all:

📣pronouns do not equal gender

You can be non binary and use she/her or he/him pronouns.

And many non binary ppl use she AND they, or he AND they.

Some non binary ppl use she, he AND they altogether. And like you to mix it up when referring to them. ~tweetbreak~ As an aside, I'm fairly sure some cis lesbians use he/him pronouns too? So it's not even just a trans thing. And we all know cis gay men who love to be she/her.*

*Though I'm not studied enough to know how comparable the two are or historical contexts etc ~tweetbreak~ SECONDLY 📣📣📣📣📣📣📣📣📣📣

Neo. Pronouns. Exist.

Many non binary people use neo pronouns, *not* they/them.

Neo pronouns are alternative pronouns people use because language. Is. Allowed. To. Evolve.

Examples include: Ze/Zir and Ey/Em

https://t.co/uxIuQjCe9b ~tweetbreak~ Pronouns are just about what bits of language feel most comfortable to us. They do not in and of themselves necessarily determine gender. ~tweetbreak~ And that's the Gender 101 class for the cis today lol.

There are no de facto male pronouns. No de facto female pronouns. No de facto nonbinary pronouns. Just pronouns that people like you to use for them. It's that simple.",1,0,0,0,0,1,1,0,0,0,0,1,1,1,1,1,1,0
AlexKokcharov,Sun Aug 09 10:23:34 +0000 2020,2020 Belarus Election,"politics, history & business",https://twitter.com/AlexKokcharov/status/1292406157714296834,"THREAD.

Today is the day of presidential election in my native Belarus. It is the 6th election in Belarusian history. Only 1994 election was deemed free and fair, and votes in 2001, 2006, 2010 and 2015 were marred by electoral fraud and government repression. 

1/x https://t.co/kboXUgGjHW","My hope for the next few days is that there is no excessive police violence on streets of Minsk and other cities, and that no blood will be shed. Belarus deserves a better future than the one offered by the current repressive state built by Lukashenka in the past 26 years.

20/20 https://t","THREAD.

Today is the day of presidential election in my native Belarus. It is the 6th election in Belarusian history. Only 1994 election was deemed free and fair, and votes in 2001, 2006, 2010 and 2015 were marred by electoral fraud and government repression. 

1/x https://t.co/kboXUgGjHW ~tweetbreak~ When the election was announced in early May 2020, it was expected that they would closely resemble the vote of 2015. During which Lukashenka, in power in Belarus since 1994, ran against the crowd of extras who did not really present any threats to him. 

2/x https://t.co/FFdi53IVMl ~tweetbreak~ It quickly emerged that Lukashenka would be challenged from an unexpected front. Not by the the established opposition, mostly confined to identity politics, but by new figures - banker Viktar Babaryka, YouTube blogger Siarhei Tsikhanouski and ex-diplomat Valery Tsapkala. 

3/x https://t.co/j0364DEAZM ~tweetbreak~ All these three challengers were ultimately eliminated from the race by the repressive state machine. Babaryka and Tsikhanouski got detained on dubious charges, and all three were ultimately not registered. But then an unexpected twist happened, which changed the race.

4/x https://t.co/vYfOfP1cUN ~tweetbreak~ Sviatlana Tsikhanouskaya, the wife of detained blogger, decided to run for presidency in his place. And she was ultimately registered as a candidate, as the sexist incumbent did not expect that a women, let alone a housewife can be a real challenge in this election.

5/x https://t.co/Nku9klWk8n ~tweetbreak~ On 14 July the Central Election Commission (CEC) registered Sviatlana Tsikhanouskaya as one of the 5 presidential candidates. Two other alternative candidates - Viktar Babaryka and Valery Tsapkala were disqualified on alleged procedural grounds. 

https://t.co/0wdtlO0liu
6/x https://t.co/KY60cUoZgi ~tweetbreak~ Two days later Sviatlana united forces with campaigns of Babaryka (with his campaign chief Maryia Kalesnikava in the photo on the left) and Tsapkala (with his wife Veranika on the right). This  pulled together resources and people.

https://t.co/a9PG0uuWhJ
7/x ~tweetbreak~ Social media in Belarus quickly responded to Tsikhanouskaya's candidacy - and her strongly feminist campaign, aided by other female politicians - with memes. And these memes clearly paint her as a favoured candidate for those on the internet:

8/x https://t.co/rV1GoPjyxj ~tweetbreak~ From late July Sviatlana and her team toured #Belarus gathering massive crowds of supporters - with up to 70,000 in Minsk and up to 20,000 in regional cities. This is unprecedented level of political mobilisation in Belarus in recent decades:

9/x https://t.co/ughPvKhYJo ~tweetbreak~ Sviatlana's electoral programme is simple:

1) Release all the political prisoners.
2) Hold a referendum on returning to the 1994 constitution, bringing back checks and balances to the political system.
3) Hold a fresh presidential election within 6 months.

10/x https://t.co/K65NYKHdmS ~tweetbreak~ The Belarusian authorities resorted to the usual tactics: they disrupted Sviatlana's campaign events in the past week, detained protesters, and declared turnout of 41.7% in the 5 days of early voting (a method of electoral rigging).

https://t.co/s60gyWdpv8
11/x https://t.co/gssjhgJPsi ~tweetbreak~ Political opinion polls are banned in Belarus, therefore we do not know electoral sentiment. But based on large protest support for Tsikhanouskaya, it looks as incumbent Lukashenka enjoys no more than 20-25% (or less!) support - mostly the loyalists and the siloviki. 

12/x https://t.co/flglu0Lydn ~tweetbreak~ In a free and fair election Sviatlana Tsikhanouskaya would probably emerge as a winner. But Belarus being Belarus, I expect that the CEC will declare Lukashenka as winner of the election, with some 70-75% of the vote. Such result will be a complete fabrication. 

13/x https://t.co/ZvYpHD3rBq ~tweetbreak~ So the big question is what happens in the days after the election. Protests are likely, but the police are likely to use force to disperse and detain protesters in large numbers. There are already reports of military vehicles on the streets of Minsk:

14/x https://t.co/tmwyh3lHKq ~tweetbreak~ If there is significant violence by the police and security services against peaceful protesters in Minsk and other cities in Belarus, this will likely lead to calls for Western countries (EU, US, etc) to re-introduce sanctions against Lukashenka and his regime. 

15/x https://t.co/Kkq1fOU0un ~tweetbreak~ If new Western sanctions against Belarusian leadership emerge, Lukashenka's victory will become a Pyrrhic one, as it will weaken him in any negotiations with Russia. Putin is likely to push for more concessions, including further political integration &amp; military bases.

16/x https://t.co/5pE7dwP6uU ~tweetbreak~ So by keeping power in Minsk in this year's sham ""election"", Lukashenka is actually likely to lose out as Belarusian sovereignty will likely be eroded further by the Union State of Russia and Belarus. 

17/x https://t.co/ojwSTzZjge ~tweetbreak~ An alternative scenario, albeit less likely: if Belarusians do not stop the resistance despite the government repression, and continue with non-violent but longer term resistance, through strikes and peaceful protests. This will crack the elites, eroding Lukashenka's power

18/x https://t.co/EqHxuEm5SI ~tweetbreak~ Under this scenario, a ""Velvet Revolution"" similar to that of Armenia in 2018, can emerge, with groups of the elites - and siloviki - withdrawing their support for Lukashenka, and switching side to the popular sentiment. However, I think that this scenario is less likely

19/x https://t.co/3jaz1GhWNj ~tweetbreak~ My hope for the next few days is that there is no excessive police violence on streets of Minsk and other cities, and that no blood will be shed. Belarus deserves a better future than the one offered by the current repressive state built by Lukashenka in the past 26 years.

20/20 https://t.co/t9UkPu68LG",0,0,1,0,0,0,1,0,0,1,0,0,0,1,0,0,1,1
cfishman,Thu Aug 27 18:21:44 +0000 2020,Wastewater Testing for Covid,health & the body,https://twitter.com/cfishman/status/1299049476288544768,"Some big news out of the University of Arizona (@uarizona):

UA scientists &amp; staff found a coronavirus outbreak on campus *before it happened* — and seem to have snuffed it out.

How in the world do you do that?

You use wastewater testing.","17/ But UArizona's wastewater testing is a smart, invaluable technique.

Let's hope other colleges and universities, and lots of other organizations, jump in and put it to use as well.

#","Some big news out of the University of Arizona (@uarizona):

UA scientists &amp; staff found a coronavirus outbreak on campus *before it happened* — and seem to have snuffed it out.

How in the world do you do that?

You use wastewater testing. ~tweetbreak~ 2/ UArizona is one of the schools that has determined to have some in-person classes, and to welcome students back to campus dorms.

Students started moving into dorms about 2 weeks ago.

Class started — on-line &amp; in-person — Monday. ~tweetbreak~ 3/ As campus reopened, Arizona set up a system to test the wastewater leaving about 20 buildings on campus, including all the dorms that are occupied.

Early work in Europe in the spring showed that people infected with coronavirus shed it into their stool very early. ~tweetbreak~ 4/ All dorms had been tested once and come up negative.

On Tuesday, one dorm — Likins Hall — showed coronavirus in the wastewater.

On Wednesday, all 311 residents of Likins were given antigen quick-tests. 2 residents were found to be positive — asymptomatic, but positive. ~tweetbreak~ 5/ Those 2 Arizona undergrads are in isolation at UA's isolation dorm now (&amp; their contacts being traced).

The other 309 residents of Likins: Back to covid-life-on-campus.

Mind you, all 311 of those residents had already been tested once, on arrival, and come up negative. ~tweetbreak~ 6/ And the initial test of the dorm's wastewater last week was negative.

So those 2 students caught the virus somewhere between coming back to school and Tuesday.

But imagine what would have happened without the wastewater testing. ~tweetbreak~ 7/ Those two students would have wandered their dorm, asymptomatic, likely infecting their fellow students unknowingly.

Then instead of 2 students in Likins being infected, you might have had 10.

Those students would have been out and about on campus, and in Tucson. ~tweetbreak~ 8/ Arizona doesn't yet have a follow-up testing regime for its students living on-campus. You had to be negative to move into the dorms, there is talk of testing everyone every 2 weeks — but for now, more testing is voluntary.

(You can get a quick test every day if you want.) ~tweetbreak~ 9/ But wastewater testing is a reasonable surrogate. 

In Europe, it caught infections a week before anyone showed symptoms.

In practice, at UArizona, that's exactly what happened: A dorm outbreak, detected, isolated, stopped in its tracks.

This is how you do it. ~tweetbreak~ 10/ Remember the fruitless mantra of the spring?

Testing.
Testing.
Testing.

It's still true. Testing is how you find infections, testing is how you protect people who might get sick, testing is how you protect everyone who isn't yet infected. ~tweetbreak~ 11/ Wastewater testing is not common at all — here in the US, or anywhere else.

It requires a consistent population (you wouldn't want to wastewater test a restaurant or a movie theater), it requires access to the pipes, &amp; an understanding of the plumbing. ~tweetbreak~ 12/ Most important: Wastewater testing requires the ability to do follow-up testing completely &amp; quickly. 

They didn't test a few kids living in Likins. They tested them all.

They didn't test them using a method that required a 3-day wait for results. 1-hour antigen test. ~tweetbreak~ 13/ Lots of *cities* don't have much in the way of quick-test ability on demand.

But this is how it's done. This is how you find people who might get sick, isolate them, and get back to work.

Imagine using wastewater testing at high schools, for instance, or workplaces. ~tweetbreak~ 14/ Arizona has the scientists on campus to develop and manage its wastewater testing. But this is not arcane science.

And to be clear: UA has 5,000 people living on-campus, but another 25,000 living off-campus.

It could still have an outbreak, and have to go all-online. ~tweetbreak~ 15/ UArizona's most recent testing data:

Total tests since reopening:
• 10,126 tests
 --&gt;46 positive

Wednesday, 8/26 testing:
• 770 tests
 --&gt; 9 positive

Note that yesterday's results are a small warning.

Overall positive rate: 0.5%
Yesterday's positive rate: 1.2% ~tweetbreak~ 16/ That dramatic jump in positivity might be a quirk of testing and who walked in yesterday. Might be a sign that as students and staff come back to campus, use the restaurants and the classrooms and see each other on the lawns, some transmission might be happening. ~tweetbreak~ 17/ But UArizona's wastewater testing is a smart, invaluable technique.

Let's hope other colleges and universities, and lots of other organizations, jump in and put it to use as well.

#",0,0,1,0,0,0,0,0,0,1,0,1,1,1,0,1,1,0
