Author,Date Posted,Title,Topic,Link,First Tweet,Last Tweet,All Tweets,Correct the Record,Counterintuitive,Time Peg,Appeal to Authority,significance statement,Refers to lede,Where to learn more,Summarizes info,Call to action,Narrative,Analogy ,Nonexamples,Signposting,Subjectivity,Informal language humor,Engage Conversationally,Credibility,Media
meehancrist,Thu Nov 21 14:51:32 +0000 2019,California Wildfires,biology & climate,https://twitter.com/meehancrist/status/1197527975379505152,"I’ve been watched the landscape of my childhood burn with an aching heart, and wondering how much climate change is to blame. Turns out human activity is a major driver of California’s wildfires, but not just in the ways you might imagine. (pic: Noah Berger) 1/10 https://t.co/aX1CIJSrGi","So as I watch my home state burn, I see how climate change contributes and how people continue to erect subdivisions in a tinderbox as if it doesn’t. 10/10","I’ve been watched the landscape of my childhood burn with an aching heart, and wondering how much climate change is to blame. Turns out human activity is a major driver of California’s wildfires, but not just in the ways you might imagine. (pic: Noah Berger) 1/10 https://t.co/aX1CIJSrGi ~tweetbreak~ Fires need 3 things to burn: fuel, oxygen, and ignition. A warming climate means less rain and less humidity, which means that California’s vegetation - potential fuel - is dryer than before. 2/10 ~tweetbreak~ Drier fuels—grasses, shrubs, forests—catch fire more easily, allowing fires to grow bigger and spread faster. So, there’s your fuel. Next, oxygen… 3/10 ~tweetbreak~ When you build a fire in a fireplace, you use a bellows or hearty lungfuls of air to blow oxygen across lit kindling and get the flames really crackling. The state of CA has its own natural bellows. 4/10 ~tweetbreak~ The Santa Anna winds in Southern CA and the Diablo winds in Northern CA are powerful wind events that have been happening in the fall for thousands of years. But climate change is both making them stronger… 5/10 https://t.co/Jji2AJ3qv0 ~tweetbreak~ and extending the hot, dry period in the fall, when these powerful winds arrive after months of little, if any, rain. When these winds gust across the tinderbox of parched vegetation, all you need is a spark to ignite a crisis. 6/10 ~tweetbreak~ Which brings us to ignition. The state’s failing power infrastructure, controlled by the private utility PG&amp;E, has sparked hundreds of wildfires in recent years, a handful of which have been catastrophic. 7/10 https://t.co/IibLv4wUtr ~tweetbreak~ But at the same time, developers are building in previously undeveloped, increasingly fire-prone areas, which means extending electrical lines and other power infrastructure into fire-prone areas... 8/10 ~tweetbreak~ and increasing the possibility of potentially devastating fires across the state. 9/10 https://t.co/cqaZGeWHfg ~tweetbreak~ So as I watch my home state burn, I see how climate change contributes and how people continue to erect subdivisions in a tinderbox as if it doesn’t. 10/10",0,1,1,0,0,0,0,0,0,1,1,0,1,0,0,0,0,1
GeneticJen,Mon Aug 14 17:50:58 +0000 2017,Dung Beetle Navigation,biology & climate,https://twitter.com/GeneticJen/status/897153589193441281,So today I was talking about evolution being amazing and literally every animal being awesome and I'm told the dung beetle isn't. Thread 👇,We think of bio as small and astronomical objects as huge and separate but things interact even at these differences in scale https://t.co/JowHzbEXAt,"So today I was talking about evolution being amazing and literally every animal being awesome and I'm told the dung beetle isn't. Thread 👇 ~tweetbreak~ ""It rolls poo"". Yeah so lemme talk about that for a second. You can either roll poo, or you wait to ambush another beetle rolling poo ~tweetbreak~ So if you're rolling poo, you wanna roll it the hell out of there as fast as possible in case you're going to get ambused ~tweetbreak~ Fastest way to get somewhere? A straight line. So dung beetles push their ball in as straight line as possible. Simple, right? ~tweetbreak~ How do dung beetles keep such a straight line? Marie Dacke, a biologist at Lund University in Sweden found they observed the sun and moon ~tweetbreak~ During the day they watch the sun and during the night they use polarised light from the moon. This was back in 2003. Good so far https://t.co/eFBWlIGD8K ~tweetbreak~ If you put the beetle in a walled area so it can't see surroundings, it uses the moon. Takes 20 secs to get to a wall ~tweetbreak~ Put a lid on top so it can't see the moon and now it takes 2 mins on average to hit a wall because they can't keep a straight line ~tweetbreak~ This is what happens if you have a light source at the top turned on and then turn on the one at 90 degrees instead. It changes course https://t.co/3mpZjBvlwf ~tweetbreak~ Marie Dacke observed something weird in the following years. If the beetle can see the sky but it's a moonless night, it still does well ~tweetbreak~ 40 seconds with moonless night sky rather than expected 2 minutes. Was she wrong? Is it not really about the moon? So she studied further ~tweetbreak~ They can't be using the stars because the beetle's eyes are too shit for that. Where you see a star they see darkness. So what gives? ~tweetbreak~ She did things like turn only the brightest stars on, or only dimmer ones, and all sorts of weird experiments to see what the beetle did ~tweetbreak~ Get this, the dung beetle can't see an individual star but it CAN see the Milky Way. Our spiral galaxy. It orients itself by our galaxy https://t.co/68sIhnLrtx ~tweetbreak~ Dung beetles might be lowly, smelly, poo-pushers but hey they're the only insect we know that observes our galaxy and I think that's cool ~tweetbreak~ We think of bio as small and astronomical objects as huge and separate but things interact even at these differences in scale https://t.co/JowHzbEXAt",1,0,1,0,0,0,0,0,0,1,0,0,1,1,1,1,1,1
random_walker,Fri Oct 11 12:34:31 +0000 2019,Why Enterprise Software Sucks,computers & technology,https://twitter.com/random_walker/status/1182635589604171776,"My university just announced that it’s dumping Blackboard, and there was much rejoicing. Why is Blackboard universally reviled? There’s a standard story of why ""enterprise software"" sucks. If you’ll bear with me, I think this is best appreciated by talking about… baby clothes!","Blackboard is 20 years old. If Twitter is around in 20 years, let's see how this prediction holds up. And now I have to go rescue a three-month old from an extremely cute and equally uncomfortable outfit.","My university just announced that it’s dumping Blackboard, and there was much rejoicing. Why is Blackboard universally reviled? There’s a standard story of why ""enterprise software"" sucks. If you’ll bear with me, I think this is best appreciated by talking about… baby clothes! ~tweetbreak~ There are two types of baby outfits. The first is targeted at people buying gifts. It's irresistible on the rack. It has no fewer than 18 buttons. At least 3 people are needed to get a screaming baby into it. It's worn once, so you can send a photo to the gifter, then discarded. ~tweetbreak~ Other baby outfits are meant for parents. They’re marked ""Easy On, Easy Off"" or some such, and they really mean it. Zippers aren't easy enough so they fasten using MAGNETS. A busy parent (i.e. a parent) can change an outfit in 5 seconds, one handed, before rushing to work. ~tweetbreak~ The point is, some products are sold directly to the end user, and are forced to prioritize usability. Other products are sold to an intermediary whose concerns are typically different from the user's needs. Such products don't HAVE to end up as unusable garbage, but usually do. ~tweetbreak~ OK, back to Blackboard! It’s actually designed to look extremely attractive to the administrators (not professors and definitely not students) who make purchase decisions. Since they can't easily test usability, they instead make comparisons based on… checklists of features. 🤦🏽‍♂️ ~tweetbreak~ And that's exactly what's wrong with Blackboard. It has every feature ever dreamed up. But like anything designed by a committee, the interface is incoherent and any task requires at least fifteen clicks (and that's if you even remember the correct sequence the first time). ~tweetbreak~ Software companies can be breathtakingly clueless when there's a layer of indirection between them and their users. Everyone who's suffered through Blackboard will have the same reaction to this: try having less functionality! https://t.co/7ZiERJc2RH https://t.co/CQ7r1nfP64 ~tweetbreak~ The grumbling about Blackboard has finally gotten loud enough that schools are paying a modicum of attention to usability when evaluating alternatives. Blackboard's market share has dropped dramatically and this will probably continue. Good. ~tweetbreak~ Here’s the kicker, though. It's extremely likely that whichever vendor emerges on top will fall into the same trap. The incentives almost guarantee it. Once profs and students put down the pitchforks, committees will go back to their checklists, and feature creep will resume. ~tweetbreak~ Blackboard is 20 years old. If Twitter is around in 20 years, let's see how this prediction holds up. And now I have to go rescue a three-month old from an extremely cute and equally uncomfortable outfit.",0,0,1,0,0,0,0,0,0,1,1,0,1,1,1,1,1,1
tony_breu,Wed Jul 11 22:52:25 +0000 2018,Why Do Fingertips Get Wrinkly in the Bath?,health & the body,https://twitter.com/tony_breu/status/1017179836320710657,"1/
""Why do my fingers get all wrinkly when I take a bath?” This was the question my 3-year-old daughter asked me recently after bath time. 

I thought for a minute, then realized I didn't have a clue. 

The explanation is so much cooler than I had expected... https://t.co/mFyeKm8Edc","16/
Next time my daughter takes a bath, I'll explain that her fingers look like raisins because she has intact sympathetic vasoconstriction with resulting retraction of fingertip pulp and that the density of eccrine sweat glands in her hands contributes.

She’s come to expect it.","1/
""Why do my fingers get all wrinkly when I take a bath?” This was the question my 3-year-old daughter asked me recently after bath time. 

I thought for a minute, then realized I didn't have a clue. 

The explanation is so much cooler than I had expected... https://t.co/mFyeKm8Edc ~tweetbreak~ 2/
Let me throw a version of my daughter's question out to you:

Which of the following contributes to “water immersion wrinkling""? ~tweetbreak~ 3/
For 40 years, I have observed, like my daughter, that my fingers look like prunes after being in water. I’ve assumed that they lost water (became dehydrated), just like prunes! 

But, that can’t be. When I submerge my hand in water, I’m placing it into a hypotonic solution. ~tweetbreak~ 4/
Reminder:

Plasma osmolality: ~285 mOsm/kg
Water osmolality: ~0 mOsm/kg

If anything, water should flow IN and make my fingertips MORE swollen. ~tweetbreak~ 5/
It's true that water enters fingers after immersion. The portals of entry are likely sweat glands (which are highly concentrated in the hands).

But, fingers appear to shrink, not swell. And it’s not uniform.

Something else must be going on.

https://t.co/VZy5eYjbJe https://t.co/v6Pu1uACP3 ~tweetbreak~ 6/
A major clue came in 1936 when Lewis and Pickering published their observation that skin innervated by a palsied median nerve failed to wrinkle. This suggested the phenomenon wasn’t simply about water flow, but that it also involved the nervous system.

https://t.co/fWZ85C43VA https://t.co/JjOYHEceZY ~tweetbreak~ 7/
It appears that nerve activation is essential to water immersion wrinkling. But what does increase nerve firing lead to? 

Sympathetic mediated vasoconstriction!

https://t.co/16WSpF9myW ~tweetbreak~ 8/
The same group that suggested vasoconstriction as a contributor to wrinkling also offered a reason for why we experience it more on the glabrous skin (i.e., smooth/hairless) of the fingertips and toes. ~tweetbreak~ 9/
Two keys regarding fingertip anatomy:

*anchoring of the epidermis to the dermis results in varying skin tautness (max where skin is anchored)
*distal digital pulp has a high concentration of blood vessels and lots of glomus bodies (AV shunts surrounded by connective tissue) ~tweetbreak~ 10/
When glomus bodies lose volume through vasoconstriction, a negative pulp pressure is generated. The result is a downward pull on the overlying skin. 

Because dermal anchoring is not uniform in the fingertips, there is variable pull.

Result: WRINKLING! ~tweetbreak~ 11/
In 2004 a more complete mechanism was proposed:

water enters via sweat glands ➡️ electrolyte abnormalities ➡️ decreased membrane stability ➡️ increased nerve firing ➡️ vasoconstriction, particularly within dermal pulp ➡️ pull-down of overlying skin ➡️ wrinkles ~tweetbreak~ 12/
Is there a way we can make use of this information clinically, or is it just cocktail party fodder?

Well, if a functioning peripheral nerve is required for water immersion wrinkling, maybe its presence/absence can be used to test for neuropathy… ~tweetbreak~ 13/
Since the 1970s, numerous groups have studies exactly this. 

It’s been used in diseases causing neuropathies as diverse as diabetes (PMID 6734390) and leprosy (PMID 3006371).

https://t.co/wbjWBdMDv2
https://t.co/0S046esGk1 https://t.co/bH821fa6Yk ~tweetbreak~ 14/
Have you ever used fingertip wrinkling to evaluate nerve function? ~tweetbreak~ 15/
Before closing, let’s return to the original question: 

Which of the following contributes to “water immersion wrinkling""? ~tweetbreak~ 16/
Next time my daughter takes a bath, I'll explain that her fingers look like raisins because she has intact sympathetic vasoconstriction with resulting retraction of fingertip pulp and that the density of eccrine sweat glands in her hands contributes.

She’s come to expect it.",0,0,1,0,0,0,1,0,0,1,0,0,1,1,0,1,1,1
IAmSuyiDavies,Sat Jun 27 17:18:57 +0000 2020,African Empires and Colonization,"politics, history & business",https://twitter.com/IAmSuyiDavies/status/1276928013163098112,I always find the “Africa is better off from the results of colonization” arguments amusing. What do people think happened with African empires &amp; their European counterparts prior to colonization? Perhaps a history lesson is in order. Thread. 1/17,"TL;DR, Colonialism benefits one party: the colonizer. None would be half what they are today without it. If you want to make an argument about one power subsuming another by wielding might, make that. But take that White Supremacist “it helped you too” bullshit outside. 17/17","I always find the “Africa is better off from the results of colonization” arguments amusing. What do people think happened with African empires &amp; their European counterparts prior to colonization? Perhaps a history lesson is in order. Thread. 1/17 ~tweetbreak~ There were so many different African empires, so I’m gonna stick to the empire from which I’m descended--the Benin Empire (what is now Benin City in Edo State in southern Nigeria)--and its relationship with the Portuguese since the early 15th century. 2/17 ~tweetbreak~ The Benin empire interacted with the British, French, Dutch and Portuguese throughout its existence, but the Benin-Portugal relationship was the chummiest. They traded goods, languages, histories, lessons. They sent emissaries and scholars to each other &amp; threw big shindigs. 3/17 ~tweetbreak~ The Lagos y’all know? Portuguese word for “lake,” named back when the land that is now Lagos was still a part of the Benin Empire. Benin Obas spoke Portuguese and sent their subjects to learn about Christianity. Early Benin art had crosses mixed with its own pantheon. 4/17 ~tweetbreak~ The Portuguese wanted slaves so Benin sold its POWs. They wanted spices, ivory &amp; coral beads, and offered textiles, tools &amp; weapons in return. They established a factory at Ughoton, Benin’s then seaport city (long before Lagos became one of West Africa’s key slaveports). 5/17 ~tweetbreak~ David van Nyendael, on visiting Benin in 1699: “When it comes to trade, they are very strict and will not suffer the slightest infringement of their customs...when one is willing to accept these customs, they are very easy-going and will cooperate in every way possible.” 6/17 ~tweetbreak~ No surprise, then, that the first point of contention arrived when King Manuel of Portugal wanted commercial monopoly, as well as for the Binis to fully accept Christianity, to which Oba Esigie was like, “Excuse you?” The decline in trade relations began after that. 7/17 ~tweetbreak~ Then, there was also disease. Them weak-ass sailors would get bitten by one tiny-ass anopheles mosquito and be like, “*cough cough* Ugh, tell my wife I love her.” The French especially suffered from this.

Then the British arrived, and it all went to shit from there. 8/17 ~tweetbreak~ Buoyed by that nonsense Berlin Conference of 1885 (smh), the British started asking for trade monopoly and control. They were so aggressive about it that the Oba banned all other trade with them, save for palm oil (to aid lubrication in the burgeoning European machine age). 9/17 ~tweetbreak~ Proud-ass Britain didn’t like being told what to do. They wrote stink pieces, commenced disinformation campaigns. Here’s Consul Richard Burton, in 1862: “...a place of gratuitous barbarity which stinks of death."" (Like we haven’t seen Oliver Twist. Pot/kettle much?) 10/17 ~tweetbreak~ By 1897, the consuls had convinced the Queen with enough lies to gather an army to take Benin by force. “Liberate the people” and convert them to Christianity. (Sound familiar, y’all summer missionary cruisers to the Caribbean with a side-dish of “converting the natives?”) 11/17 ~tweetbreak~ The 1897 Benin Expedition &amp; deposition of Oba Ovonramwen happened then. You can read about it anywhere (except the British Museum’s revisionist take, to which I cackled when I visited). TL;DR, Benin was overrun, palace burnt, Oba exiled, art carted to Britain’s museums. 12/17 ~tweetbreak~ In similar fashion, the British colonized everywhere that is now Nigeria, sucked off resources of countless groups until 1960. Then they drew border lines, binding this mix of tribes, languages &amp; customs, &amp; threw a few coins at them. “Shoo, now. Go take care of yourselves.” 13/17 ~tweetbreak~ So when people say, “colonialism benefited Africans,” this is why I want to wash their mouths with a soap bar.

“But the Africans got technology,” you say. “Became modern.”

You mean like they would’ve done if they had continued to, I dunno, trade on their own terms? 14/17 ~tweetbreak~ Why do folks behave like Europe &amp; Asia didn’t once have limited tech? They progressed through partnerships &amp; exchange, like all colonized peoples should’ve had the chance to. Name one never-disenfranchised nation that is not currently working toward global contention. 15/17 ~tweetbreak~ In fact, Benin was actually one of the leaders in architecture at their time. Google “Walls of Benin.” The largest-ever earthwork project prior to mechanization, at one point “four times longer than the Great Wall of China.” Seriously, look it up: https://t.co/lCwNG6gYAa 16/17 ~tweetbreak~ TL;DR, Colonialism benefits one party: the colonizer. None would be half what they are today without it. If you want to make an argument about one power subsuming another by wielding might, make that. But take that White Supremacist “it helped you too” bullshit outside. 17/17",1,0,0,0,1,0,0,0,0,1,1,1,1,1,1,1,1,0
Foone,Tue Jul 03 21:59:54 +0000 2018,Our Visual System and Saccades,health & the body,https://twitter.com/Foone/status/1014267515696922624,"You want to know something about how bullshit insane our brains are?
OK, so there's a physical problem with our eyes: We move them in short fast bursts called ""saccades"", right? very quick, synchronized movements.
The only problem is: they go all blurry and useless during this","It's tempting to think of your eyes and visual system as a camera just dumping a video feed into your conscious brain but that's so very, very not the case. What you think you see and what your eyes can actually see are two exceptionally different things.","You want to know something about how bullshit insane our brains are?
OK, so there's a physical problem with our eyes: We move them in short fast bursts called ""saccades"", right? very quick, synchronized movements.
The only problem is: they go all blurry and useless during this ~tweetbreak~ having your vision turn into a blurry mess every time you move your eyes is obviously not a good idea, so our brains hide it from us. Now, imagine you're an engineer and you have this problem. ~tweetbreak~ You've got some obvious solutions you could do.
1. make the vision go black during movement. (Some VR games do this!)
2. just keep showing the last thing we saw prior to movement ~tweetbreak~ both are good options with different downsides, but OH NO. this is assuming everything makes sense and is chronological and (regular) logical. 
Your brain does neither of these options, really. ~tweetbreak~ first, it basically puts your visual system on ""pause"". You're not seeing blackness or even nothing, you're just not seeing period.
then when you finish your saccade, it shows you what you now see at the new position. and then it pretends it can time travel. ~tweetbreak~ it seriously shows you the image at the new point, but time-shifts it backwards so that it seems like you were seeing it the whole time your eyes were moving.
And because your brain is not a computer with a consistent clock, this shit works. ~tweetbreak~ you can see this effect happen if you watch an analog clock with a second hand.
Look away (with just your eyes, not your head), then look back to the second hand.
It'll seem like it takes longer than a second to move, then resumes moving as normal. ~tweetbreak~ that's because your freaking visual system just lied to you about HOW LONG TIME IS in order to cover up the physical limitations of those chemical camera orbs you have on the front of your face. ~tweetbreak~ we've known about this effect for over 100 years, it's called ""Saccadic masking"" and more specifically Chronostasis. Your visual system lies to you about WHEN things happen by up to half a second(!) just to avoid saccades blurring everything. ~tweetbreak~ So while I firmly believe we're basically just overgrown biological computers, we're apparently computers programmed by batshit insane drunkards in Visual Basic 5. ~tweetbreak~ and you might think ""hey wait, wouldn't my vision 'pausing' for half a second have all kinds of weird effects on moving objects? why don't they appear to stutter when moving?""
and the answer is simple! your brain has EVEN MORE UGLY HACKS on top of this to avoid you seeing that ~tweetbreak~ if you've got a clock where the second hand doesn't ""tick"" but instead smoothly rotates, you won't see this. Because your brain recognizes it's moving and adjusts what you see to make sure it sees the ""right"" thing. ~tweetbreak~ it's only really obvious with periodically moving things like a clock hand, because it's not moving (so not triggering the movement-during-chronostatis hack) but it moves at a set rate, so you can notice that rate appearing to change. ~tweetbreak~ It's tempting to think of your eyes and visual system as a camera just dumping a video feed into your conscious brain but that's so very, very not the case. What you think you see and what your eyes can actually see are two exceptionally different things.",0,0,0,0,0,0,0,0,0,1,1,0,1,1,1,1,0,0
