RafiDAngelo,Mon Aug 03 19:00:29 +0000 2020,"History of the Word ""Ebonics""","politics, history & business;culture & the humanities",https://twitter.com/RafiDAngelo/status/1290361915726757890,"The only reason any of us cringe at ""ebonics"" is bc we grew up with news media telling us it was bad after the Oakland controversy. A short history thread. 1/ https://t.co/hby7lCmN2b","I just re-read this thread and realized I put ""ebony"" and ""linguistics"" but I meant to type ""phonics."" I was doing too much at the time (eating grits and watching Umbrella Academy).","The only reason any of us cringe at ""ebonics"" is bc we grew up with news media telling us it was bad after the Oakland controversy. A short history thread. 1/ https://t.co/hby7lCmN2b ~tweetbreak~ Robert Williams, a Black psychologist, came up with the name ""Ebonics"" in the 70s by combining Ebony and linguistics. Before that, our vernacular was widely known as ""nonstandard Negro English"" which puts us at a deviation from English, as opposed to Ebonics, our own dialect. ~tweetbreak~ Educators has been studying how we spoke for decades and in the 80s and 90s teachers finally realized we were putting too many Black kids in special ed classes simply because of how we spoke at home and we should be doing what Norway was doing. ~tweetbreak~ Norway has a lot of dialects. If a kid came in speaking a (making this name up) Crystal dialect, the teacher would say ""that's how you speak at home using these rules, and this is how those rules translate into standard Norweigian."" They would use Crystal as a springboard. ~tweetbreak~ In the US, we didn't do that. If you spoke Ebonics, your teacher would basically go ""that's wrong, don't say that"" and punish you OR you would score lower on IQ tests because no one had taught you how English relates to Ebonics. ~tweetbreak~ Oakland says ""hmm...why don't we give our teachers the tools to understand Ebonics so when kids come in speaking it, they can relate the rules of Ebonics to the rules of standard English so the kids will speak both and score better on tests."" ~tweetbreak~ WHITE AMERICA THREW A FIT and tens of thousands of news stories in the mid 90s said that Oakland was trying to teach kids Ebonics. Liberal and Conservative publications both trashed Oakland's idea and Ebonics became a bad word. ~tweetbreak~ No one was paying attention to what Oakland actually proposed -- which is taking kids who ALREADY KNOW EBONICS (so why would we have to teach them?) and relating English rules to those rules so they could switch more effectively and do better in school. ~tweetbreak~ A head start group famously ran this image of a MLK-like figure in the New York Times to protest Ebonics. Notably, this is INCORRECT Ebonics anyway, as this subject/verb agreement is not one found in the way we speak -- another instance of white people outside of their lane. https://t.co/XoalPfanq5 ~tweetbreak~ That's why ""Ebonics"" sounds like a bad word to a lot of people. White America had another knee-jerk reaction to a perceived threat to white supremacy, this time in the form of our language being ""taught"" in schools, and did everything they could to stamp it out. ~tweetbreak~ Congress got involved and went so far as to threaten Oakland with pulling federal funds if they even proposed anything close to ""teaching"" Ebonics.

And now we say AAVE because white people got scared of Ebonics in 1996 and we're still dealing with it. /end ~tweetbreak~ I just re-read this thread and realized I put ""ebony"" and ""linguistics"" but I meant to type ""phonics."" I was doing too much at the time (eating grits and watching Umbrella Academy).",0,0,0,0,0,0,0,1,0,1,1,0,0,1,1,0,0,1
ajpizzuto,Thu May 21 01:38:16 +0000 2020,Is NASA Detecting Parallel Universes?,physics & maths,https://twitter.com/ajpizzuto/status/1263282933059727360,"OK, so, I've seen a lot of the ""NASA detects parallel universe"" stuff going around

I've spent the last ~2 years of grad school investigating these detections, and wanted to provide a bit of background and clarification 

(1/n)","And finally, for a quick explanation of the physics mentioned in the paper in the news, see this great thread by @litgenstein https://t.co/g3IOiNWlhE","OK, so, I've seen a lot of the ""NASA detects parallel universe"" stuff going around

I've spent the last ~2 years of grad school investigating these detections, and wanted to provide a bit of background and clarification 

(1/n) ~tweetbreak~ ANITA, a detector that flies in Antarctica, detected some strange signals. These signals are hard (but not impossible) to remedy with our current models of physics

(2/n) ~tweetbreak~ Why? 

Because the detections made it look like a very high energy particle (the elusive neutrino) traveled through the entire Earth. BUT, neutrinos with this much energy aren't expected to do this, they should crash into things along the way

(3/n) ~tweetbreak~ So, here come the weird ideas. 

Scientists try to come up with ways of modifying our understanding of physics to make these detections more plausible. SOME of these require bizarre beyond the standard model ideas, like the one in the news

(4/n) ~tweetbreak~ However, there are some COMPLETELY non-exotic explanations as well. These include:

(1) Astrophysics (see a recent paper by myself and others like @IbrahimSafa1 https://t.co/naV5yUo01Y)
(2) Systematics (which basically means something unaccounted for in the experiment) 

(5/n) ~tweetbreak~ Lately, some of the systematic explanations have looked really promising. These include things like weird features in Antarctic ice that could distort the signal of otherwise innocuous cosmic rays

https://t.co/vfDY0AeLdr

(6/8) ~tweetbreak~ For a great summary of the ANITA detections and some implications of the physics, see this article (https://t.co/Ewm0Mid2yR) by the very talented @OKeefeMadeleine 

(7/8) ~tweetbreak~ And finally, for a quick explanation of the physics mentioned in the paper in the news, see this great thread by @litgenstein https://t.co/g3IOiNWlhE",1,0,1,1,0,0,0,0,0,1,0,0,1,1,1,1,1,0
kira_thurman,Thu Jun 18 17:04:47 +0000 2020,Was Beethoven Black?,"politics, history & business",https://twitter.com/kira_thurman/status/1273662957579272193,"Hi gang! I'm not on twitter much right now, but because several of you have asked for my take on the question, ""Was Beethoven Black?""

Here's my answer as a scholar who writes about black musicians in Europe for a living:

1/?","In sum: I'd love to read through the original 18th century sources again and examine the question, ""Was Beethoven Black?"" But trust me when I say that there are still plenty of Black musicians for us to study—and celebrate!—anyway. We don't need Beethoven, fam.","Hi gang! I'm not on twitter much right now, but because several of you have asked for my take on the question, ""Was Beethoven Black?""

Here's my answer as a scholar who writes about black musicians in Europe for a living:

1/? ~tweetbreak~ Surprise! I can't answer that question yet. I haven't had time to go through original German sources and read them for myself. But I can tell you that the question, ""Was Beethoven Black?"" has been around since the 1930s, when African American journalists began to circulate it. https://t.co/roDIToa196 ~tweetbreak~ The question, ""Was Beethoven Black"" got picked up again  in the 1960s by Malcolm X and Stokely Carmichael. See Michael Broyles's book, Beethoven in America.  They wanted to associate blackness with genius, which white people constantly denied. 

https://t.co/BygrBFN8jH ~tweetbreak~ But to my mind, Beethoven being black is a red herring. We don't need him to prove our genius. But do you know a figure who was Black during Beethoven's day? ~tweetbreak~ Violinist George Bridgetower (1791-1860). The son of an Afro-Caribbean servant and a Polish mother at the Esterhazy palace, he was a student of composer Joseph Haydn and a friend of Beethoven. Beethoven dedicated a violin sonata to him, which was so hard to play many gave up. https://t.co/TEwoMp6rcr ~tweetbreak~ The African American musicologist Maud Cuney Hare first championed George Bridgetower in 1927, the centenary of Beethoven's death. She noticed that white musicologists only talked about Beethoven—not Bridgetower. https://t.co/n433UFBwxr ~tweetbreak~ So instead of asking the question, ""Was Beethoven Black?"" ask ""Why don't I know anything about George Bridgetower?"" I, frankly, don't need any more debates about Beethoven's blackness. But I do need people to play the music of Bridgetower. And others like him. ~tweetbreak~ There are already many Black European composers whose music deserves our ears. Chevalier de St. George. Samuel Coleridge Taylor. Edmond Dédé. Amanda Aldridge. Instead of programming Beethoven's 5th another time, why aren't musicians performing their works? https://t.co/t2jrME6M40 ~tweetbreak~ In sum: I'd love to read through the original 18th century sources again and examine the question, ""Was Beethoven Black?"" But trust me when I say that there are still plenty of Black musicians for us to study—and celebrate!—anyway. We don't need Beethoven, fam.",0,0,1,1,1,0,0,0,0,1,0,0,1,1,0,1,1,1
Candice_Chirwa,Sun Jun 14 16:38:43 +0000 2020,Menstrual Clots,health & the body,https://twitter.com/Candice_Chirwa/status/1272206846124793857,"[Thread]: Menstrual Clots - What are they all about? This thread will explain the large, dark clumps jelly with your period. It might be surprising to see a thick glob of menstrual blood, but, in most cases, blood clots are a natural part of menstruation. (Spongebob Edition) https://t.co/Y","Disclaimer 🚨: I, The Minister of Menstruation am not a medical professional and gives this advice based on my research and experience. If you have further questions or concerns, speak to a trusted medical professional. https://t.co/K9IztqUxtz","[Thread]: Menstrual Clots - What are they all about? This thread will explain the large, dark clumps jelly with your period. It might be surprising to see a thick glob of menstrual blood, but, in most cases, blood clots are a natural part of menstruation. (Spongebob Edition) https://t.co/YZOkADa1Bp ~tweetbreak~ Clots are the natural result of your body taking care of you. Clots are a natural way of controlling bleeding. They can appear like clumps, chunks, and/or a jelly-like consistency and can vary in size and number. https://t.co/5RXyOgSfHs ~tweetbreak~ Menstrual clots are gel-like blobs of coagulated blood, tissue, and blood that are expelled from the uterus during menstruation. Most menstruators will experience menstrual clots at some point in their lives. https://t.co/3bIXxMPBeN ~tweetbreak~ What causes Menstrual Clots? During menstruation, the endometrial cells that line the uterus strip away and leave the body. As this happens, the body releases proteins that cause the blood in the uterus to coagulate. https://t.co/lDK2cS0HWn ~tweetbreak~ This coagulation prevents the blood vessels in the uterine lining from continuing to bleed. The coagulation proteins within the blood may start to clump together, resulting in menstrual clots. ~tweetbreak~ In other words: Menstrual blood clots are a natural part of the body's defense mechanism. The thick, jelly-like texture of a menstrual clot helps prevent too much blood from escaping. https://t.co/xJpVtbONbt ~tweetbreak~ I repeat this again: Period clots are nothing to worry about (really), and they tend to come with heavy-ish periods. Period clots are not a sign that there is something wrong unless the following happens: https://t.co/TOVR5a1n3d ~tweetbreak~ If the clots are small, no larger than a R2 coin, and only occasional, they’re usually nothing to worry about. HOWEVER, if you experience regular passing large clots, then you need to cut the cameras and see your doctor. https://t.co/QpDZjqXKjj ~tweetbreak~ If you experience heavy periods with large blood clots that leave you feeling light-headed - see your doctor. You should also consult your doctor if you notice a sudden change in your period, or if you’re experiencing overall discomfort. https://t.co/zVg6Ihp2qa ~tweetbreak~ Menstrual clots are a normal part of a menstruators life. While they may look alarming, small clots are normal and common. Even clots bigger than a R2 coin aren’t noteworthy UNLESS they happen regularly. If you regularly pass large clots - you should consider seeing your doctor. https://t.co/Lhcx5ENzNM ~tweetbreak~ This is a short thread, but as usual - my DM’s are open if you want to ask any period related question. https://t.co/XzrOz6J9SO ~tweetbreak~ Disclaimer 🚨: I, The Minister of Menstruation am not a medical professional and gives this advice based on my research and experience. If you have further questions or concerns, speak to a trusted medical professional. https://t.co/K9IztqUxtz",0,1,0,0,0,0,0,0,0,1,0,0,1,0,0,1,1,1
Luke_Bell_1987,Mon Feb 17 15:01:55 +0000 2020,Nitrates in Rocket Salad,health & the body,https://twitter.com/Luke_Bell_1987/status/1229420716870770690,"There's been a story in a UK tabloid (that I won't name), and @BBCRadio4  of all places; that #rocket #salad causes #cancer due to high levels of #nitrates in the leaves. Here's my take, and what's wrong with the thinking behind it.

A thread. 

1/12 https://t.co/oVaUVr1UAe","Generally, #scientists and #nutritionists agree that the benefits of eating #vegetables and #salads far outweigh any small risks 

12/12 https://t.co/6BM4R3T3nN","There's been a story in a UK tabloid (that I won't name), and @BBCRadio4  of all places; that #rocket #salad causes #cancer due to high levels of #nitrates in the leaves. Here's my take, and what's wrong with the thinking behind it.

A thread. 

1/12 https://t.co/oVaUVr1UAe ~tweetbreak~ It's true, #rocket #leaves are hyperaccumulators of #nitrates ; this isn't anything new. It's been known for a long time. Other crops with high nitrate content include #spinach and #watercress

2/12 https://t.co/Bc4Ob30ftD ~tweetbreak~ Nitrate content varies according to where the #crop is grown, and is closely tied to the soil #plants are grown in, and the amount of #light they receive. Rocket leaves grown in #winter have higher nitrate content than those grown in #summer

3/12 https://t.co/yG4xQSgzu3 ~tweetbreak~ The #EU introduced in regulation No. 1881/2006 to impose 'limits' on nitrate in rocket. These values were completely arbitrary, and not based on any #scientific #clinical data. The 'limits' for spinach, are half that of rocket, yet both can contain similar amounts.

4/12 https://t.co/BssK5LIQwo ~tweetbreak~ Nitrates are thought to react with acid in the stomach to produce nitrosamines. It is these products which are thought to be #carcinogenic

No human studies have ever conclusively proved this to be the case.

5/12 https://t.co/9hfHnp04oQ ~tweetbreak~ The body of #evidence arguably lies with the opposite #hypothesis ; that nitrate is beneficial for human #health

E.g. Some studies related to #sports #nutrition have found beneficial effects in athletes who consume nitrate-rich #vegetables

https://t.co/ZyIiRHQ4ba

6/12 ~tweetbreak~ There are also noted benefits for blood pressure: 

https://t.co/6JI7s9LBTr 

This study specifically used rocket 

7/12 https://t.co/aRqyVGuuql ~tweetbreak~ There are even reported beneficial effects for smokers who consume more nitrate: 

https://t.co/RQliJuQYeT

8/12 https://t.co/dUFmmxYLGG ~tweetbreak~ The tabloid #article also completely missed the fact that rocket produces other #phytochemicals that have been linked with positive health effects, such as #isothiocyanates and #flavonols

9/12 https://t.co/xkX4IMBQBr ~tweetbreak~ My own and @cwagstaff 's research has shown that the isothiocyanate #sulforaphane (linked with anti-cancer effects; specifically prostate cancer) is stable or even increases in rocket leaves #postharvest

https://t.co/bt65XvpAm5

10/12 https://t.co/GuxuwGW3el ~tweetbreak~ Rocket also contains high concentrations of #polyphenols. Work by @ggkuhnle et al. @UniRdg_FNS  has shown that these reduce the formation of carcinogenic nitrosamine compounds, and promote formation of anti-cancer nitroso-polyphenol derivatives: 

https://t.co/5WytG4QxJT

11/12 https://t.co/cgS8HmY6Iv ~tweetbreak~ Generally, #scientists and #nutritionists agree that the benefits of eating #vegetables and #salads far outweigh any small risks 

12/12 https://t.co/6BM4R3T3nN",1,0,1,0,0,1,0,0,0,1,0,0,0,1,0,0,1,1
HasBezosDecided,Mon Jul 29 00:29:21 +0000 2019,"Why Millionaires Don't ""Earn"" Their Money","politics, history & business",https://twitter.com/HasBezosDecided/status/1155636395236634624,"WHY YOU'LL ALWAYS BE ROBBED AT WORK, AND WHY NO MILLIONAIRE HAS EVER ""EARNED"" THEIR MONEY:

So, let's imagine I'm a business owner and you come to me looking for a job. 

We talk about your the terms of your employment and eventually we come to the big question:","Taking the initial gamble does not justify then doing horrible things after it. 

Feel free to bookmark and link this thread comrades to folks so we can spread the information and educate.

We change hearts through kindness and education.","WHY YOU'LL ALWAYS BE ROBBED AT WORK, AND WHY NO MILLIONAIRE HAS EVER ""EARNED"" THEIR MONEY:

So, let's imagine I'm a business owner and you come to me looking for a job. 

We talk about your the terms of your employment and eventually we come to the big question: ~tweetbreak~ How much you'll get paid. 

After some chatter, we agree on $10 an hour (for simplicity's sake). 

Now, I want you to think about this: 

When you come and work for me, through your labour you're going to be producing a certain amount of value every hour. ~tweetbreak~ Now here's the thing about this. 

We agreed that I'll pay you $10 an hour.

Now, if you are creating $10 an hour in value for the business, I'm breaking even on cost and I don't have an incentive to hire you - it makes no difference ~tweetbreak~ If you're creating LESS than $10 an hour in value through your labour, well then I'm losing money on you and am actively disincentivised from hiring you. 

BUT, if you're creating more than $10 an hour in value for me (say $15 an hour), but I'm only paying you... ~tweetbreak~ ...$10, where that other $5 going? 

That $5 is called ""surplus value"", or as you'll probably know it as: 

""Profit""

Now, if you're producing $15 an hour for me and I'm returning you $10, well then I'm making $5 an hour off of you and I definitely want to hire you. ~tweetbreak~ That means that if you're giving away 1/3 of what you produce through your labour every hour, you're working at least 20 minutes of every hour FOR FREE. 

You add that up after an 8 hour day, and  for 2hrs 40mins of that day you've PAID ME to work for me. ~tweetbreak~ Now, say I don't have one employee. Say I have five. All producing $15/hr, all being paid $10/hr

At the end of the day, I'm walking home with $200 (5x8=40, 40x5=200), and each of my employees are going home with $80. ~tweetbreak~ If you work for me for three years, that means that you have spent an entire year of your life working for me, not just for free, but PAYING ME to work FOR ME. ~tweetbreak~ All business owners do this, but some on a much larger scale than others. 

Jeff Bezos has done this thousands of times over to thousands of people. 

Remember that machinery improves productivity so each worker could be producing FAR more than they're being paid. ~tweetbreak~ This is why Jeff Bezos did not ""earn"" his money - he took it 

This is why he's not being generous by hiring people - it's in his interest more than anyone elses in that relationship to hire someone.

He hasn't ""given"" his workers a job - they've given him their surplus value. ~tweetbreak~ These rich bastards who run the media, who run our world, want you to think they ""earned"" their wealth so that you don't think their position is unjust - but it is. It's based on robbery of workers. ~tweetbreak~ ""He took the initial risk in setting up the business - it's OK for him to profit because he took that gamble.""

Would it be ethical to profit off of sweatshop labour because I took the risk and invested to set it up? ~tweetbreak~ What about profiting off of a slave plantation? Once upon a time folks had to gamble an investment to set that up - but today we all agree the inherent structure of slavery was unjust and wrong. 

The same applies today to capitalist enterprises. ~tweetbreak~ Taking the initial gamble does not justify then doing horrible things after it. 

Feel free to bookmark and link this thread comrades to folks so we can spread the information and educate.

We change hearts through kindness and education.",0,0,0,0,1,0,0,0,1,1,1,0,1,1,0,1,0,0
wcaleb,Tue Jul 28 14:09:00 +0000 2020,"Why ""States' Rights"" Wasn't the Cause of the Civil War","politics, history & business",https://twitter.com/wcaleb/status/1288114234170064897,"1. Here's a short thought experiment that might help students or others understand why historians today reject ""states' rights"" as the cause of the Civil War. Imagine that 150 years from now, someone tells you that conservatives in 2020 were defenders of states' rights ...","10. In short, the true, full story of the antebellum sectional &amp; political crisis can't be explained without centering slavery, not states' rights, as the source of conflict. Leaving slavery out would be like writing the history of this moment without the coronavirus.","1. Here's a short thought experiment that might help students or others understand why historians today reject ""states' rights"" as the cause of the Civil War. Imagine that 150 years from now, someone tells you that conservatives in 2020 were defenders of states' rights ... ~tweetbreak~ 2. That person would be able to produce lots of quotes seeming to support their point. A Texas governor, e.g., saying Texas knows best how to handle its own coronavirus response. Resistance to federal stimulus dollars, etc. ~tweetbreak~ 3. But 150-year-old You would remember that 2020 was more complex. You'd point out that Democratic mayors and governors asserted local rights to issue mask orders. And that Republicans supported federal power being used against protestors. ~tweetbreak~ 4. And that some conservatives who trumpeted the virtues of federalism were also hyper-nationalists who insisted deference be shown to the flag &amp; wanted to curtail school curricula that questioned American exceptionalism. ~tweetbreak~ 5. In other words, 150-year-old You would remember that ""states' rights"" cut both ways &amp; popped up in arguments across the political spectrum. It would not explain the roots of political polarization and division in this moment. ~tweetbreak~ 6. That's what historians today know about the United States 150 years ago as well. They are able to put quotes from secessionists about states' rights in a wider historical context about antebellum politics. ~tweetbreak~ 7. Historians of that antebellum context know, for example, that proslavery secessionists had championed the use of federal power to attack abolitionist agitation and enforce the Fugitive Slave Law. ~tweetbreak~ 8. Historians know that free-state governors, legislators, &amp; mayors resisted incursions on local and state power by the federal ""Slave Power."" And they know that future secessionists were also hyper-nationalists who told abolitionists to love their country or leave it. ~tweetbreak~ 9. Thinking about how the history of this moment may be written may help you see why ""states' rights"" theory was always itself a revision of what actually happened in the Civil War Era. https://t.co/TOV2XnDldg ~tweetbreak~ 10. In short, the true, full story of the antebellum sectional &amp; political crisis can't be explained without centering slavery, not states' rights, as the source of conflict. Leaving slavery out would be like writing the history of this moment without the coronavirus.",0,0,0,0,0,0,0,0,0,1,1,0,0,0,0,,0,0
